{
  "schema_version": "1.0.0",
  "mode": "fixture",
  "fixture_id": "00000000-0000-4000-8000-000000000102",
  "endpoint_id": "00000000-0000-4000-8000-000000000101",
  "platform": "windows",
  "limits": {
    "instructions": 100000,
    "collection": 10000,
    "work": 1000000,
    "call_depth": 128
  },
  "accounting": {
    "instructions": 10,
    "work": 1649,
    "peak_call_depth": 1,
    "peak_storage_bytes": 67990
  },
  "outcome": {
    "status": "success",
    "value": {
      "kind": "forensic_result",
      "value": {
        "endpoint_id": "00000000-0000-4000-8000-000000000101",
        "observed_at": "2026-09-18T00:00:00Z",
        "system": {
          "platform": "windows",
          "hostname": "fixture-windows",
          "release": "synthetic"
        },
        "indicators": [
          {
            "indicator_id": "00000000-0000-4000-8000-000000000120",
            "kind": "fixture_match",
            "message": "Authored fixture match; not live detection.",
            "record_ids": [
              "00000000-0000-4000-8000-000000000110",
              "00000000-0000-4000-8000-000000000111"
            ]
          }
        ]
      }
    }
  }
}
